number,value,params_C,params_colsample_bytree,params_learning_rate,params_max_depth,params_min_samples_leaf,params_min_samples_split,params_model_name,params_n_estimators,params_sampling_mode,params_smote_k,params_subsample,state,duration
0,0.6910007134614515,,,,7.0,3.0,2.0,random_forest,18.0,over,,,COMPLETE,0 days 00:00:03.693138
1,0.6721800282851191,,,,3.0,2.0,3.0,random_forest,21.0,over,,,COMPLETE,0 days 00:00:02.916394
2,0.6938474431832523,,,,8.0,3.0,4.0,random_forest,18.0,under,,,COMPLETE,0 days 00:00:04.915076
3,0.6938325712740602,,,,8.0,5.0,3.0,random_forest,27.0,smote,8.0,,COMPLETE,0 days 00:00:27.135494
4,0.7072262242374631,,0.9718963510252661,0.27295232962610555,7.0,,,lightgbm,27.0,under,,0.9822985297124871,COMPLETE,0 days 00:00:03.624776
5,0.7083691559516371,,0.5181818632608555,0.1989996836540362,5.0,,,xgboost,29.0,over,,0.8762645481165459,COMPLETE,0 days 00:00:03.408565
6,0.7090910925553665,,0.9428744776069711,0.17961487798736236,5.0,,,xgboost,29.0,under,,0.824395905147628,COMPLETE,0 days 00:00:03.366523
7,0.6978742632047968,0.8377203202300314,,,,,,svm,,under,,,COMPLETE,0 days 00:00:15.776432
8,0.6939405198904612,,,,8.0,1.0,10.0,random_forest,27.0,smote,7.0,,COMPLETE,0 days 00:00:26.758317
9,0.6911108965546523,,0.9433125778021964,0.23220970835975083,7.0,,,xgboost,8.0,under,,0.515964925037216,COMPLETE,0 days 00:00:04.674548
10,0.6952870371876777,1.2431606545934313,,,,,,svm,,smote,6.0,,COMPLETE,0 days 00:01:00.563605
11,0.6755568608389327,,0.7636832456224636,0.056006167310688054,4.0,,,xgboost,9.0,under,,0.7093143151202904,COMPLETE,0 days 00:00:02.306407
12,0.7096410565873041,,0.5273475146325064,0.1554937578927579,5.0,,,xgboost,30.0,over,,0.879791502198734,COMPLETE,0 days 00:00:02.886626
13,0.7061272697453287,,0.5159971189401411,0.12285112776781898,5.0,,,xgboost,23.0,over,,0.7945122570015986,COMPLETE,0 days 00:00:03.001253
14,0.7097226874065274,,0.7379482975339338,0.14400349736643853,5.0,,,xgboost,30.0,over,,0.8620427971859804,COMPLETE,0 days 00:00:04.388942
15,0.6848895044933889,,0.656435058949687,0.113142677997638,3.0,,,lightgbm,13.0,over,,0.9463860543062657,COMPLETE,0 days 00:00:03.273355
16,0.6944303652949552,2.938294149029311,,,,,,svm,,over,,,COMPLETE,0 days 00:00:36.566307
17,0.7077545846636015,,0.7171594330154655,0.12609883503874975,6.0,,,xgboost,23.0,over,,0.6849990828045549,COMPLETE,0 days 00:00:04.380850
18,0.6817497860165936,,0.6204309355886031,0.04823032263964534,4.0,,,xgboost,13.0,over,,0.894492452047251,COMPLETE,0 days 00:00:02.453072
19,0.709493497630597,,0.8273970463897609,0.15210294158439755,6.0,,,xgboost,30.0,over,,0.7651025174844804,COMPLETE,0 days 00:00:03.299195
20,0.7013168277621181,,0.8156179813483628,0.09319420186930205,4.0,,,lightgbm,24.0,over,,0.8646879320010044,COMPLETE,0 days 00:00:03.091686
21,0.7003229626346533,,0.5990344995950019,0.08645614633374393,4.0,,,lightgbm,24.0,over,,0.6158380754418553,COMPLETE,0 days 00:00:02.946778
22,0.7096522010905696,,0.8357028294898416,0.16400137935000975,6.0,,,xgboost,30.0,over,,0.7566690086536849,COMPLETE,0 days 00:00:05.336469
23,0.7090326573943427,,0.8393144307082085,0.1644774216745573,6.0,,,xgboost,30.0,over,,0.7541450926936706,COMPLETE,0 days 00:00:05.560196
24,0.7092128689799058,,0.8549305588297555,0.17191277669974225,6.0,,,xgboost,30.0,over,,0.9052756903808712,COMPLETE,0 days 00:00:03.211064
25,0.7102648655918357,,0.8671138135926018,0.2181316831674287,5.0,,,xgboost,26.0,over,,0.9287697430780782,COMPLETE,0 days 00:00:02.968391
26,0.7051010106620744,,0.7107815891198122,0.20866412785270086,5.0,,,xgboost,26.0,smote,3.0,0.8274085272204212,COMPLETE,0 days 00:00:23.732857
27,0.7106862660963785,,0.8834350921090066,0.23006823732575474,9.0,,,xgboost,26.0,smote,3.0,0.995400557439909,COMPLETE,0 days 00:00:30.079082
28,0.7076355282164486,,0.8937879155320972,0.2644037667314473,6.0,,,xgboost,26.0,over,,0.9977867765618655,COMPLETE,0 days 00:00:04.748272
29,0.6982164825503694,,0.7699371070437703,0.23933562994928093,9.0,,,xgboost,21.0,over,,0.9374026091811392,COMPLETE,0 days 00:00:03.802118
30,0.693975432967512,2.678922230017231,,,,,,svm,,smote,3.0,,COMPLETE,0 days 00:01:11.113752
31,0.6939502340548248,2.750982201178145,,,,,,svm,,smote,3.0,,COMPLETE,0 days 00:01:17.741718
32,0.7098131199804567,,0.8916235808424341,0.2140310067336825,9.0,,,xgboost,28.0,smote,10.0,0.942846527433645,COMPLETE,0 days 00:00:30.645538
33,0.7106384131058366,,0.8941846025837334,0.20851724679001093,9.0,,,xgboost,28.0,smote,5.0,0.9501037540560733,COMPLETE,0 days 00:00:29.346312
34,0.7094104094467246,,0.8987097066174777,0.2937624406762368,9.0,,,xgboost,25.0,smote,10.0,0.9457849533894689,COMPLETE,0 days 00:00:29.874052
35,0.6961559457432211,,,,9.0,5.0,8.0,random_forest,26.0,smote,10.0,,COMPLETE,0 days 00:00:26.167166
36,0.6937065311484959,,,,9.0,5.0,8.0,random_forest,21.0,smote,5.0,,COMPLETE,0 days 00:00:26.185550
37,0.6954394091143428,,,,9.0,1.0,7.0,random_forest,21.0,smote,5.0,,COMPLETE,0 days 00:00:26.065900
38,0.7081552198335485,,0.8947865679814062,0.22344759516564525,8.0,,,xgboost,19.0,smote,5.0,0.9718672814441833,COMPLETE,0 days 00:00:26.478662
39,0.7115165323853733,,0.8966939817799894,0.2284604560030927,8.0,,,xgboost,28.0,smote,5.0,0.9703575317095703,COMPLETE,0 days 00:00:29.138618
40,0.7106542582961556,,0.9272339195355005,0.2506989162887951,8.0,,,xgboost,28.0,smote,8.0,0.925099257308624,COMPLETE,0 days 00:00:28.861674
41,0.7105553144529315,,0.9972682018250902,0.25995277541508655,8.0,,,lightgbm,28.0,smote,4.0,0.9170351534911307,COMPLETE,0 days 00:00:25.314132
42,0.7088938318454888,,0.9324545640180787,0.25075200475728066,8.0,,,xgboost,28.0,smote,8.0,0.9138569016659513,COMPLETE,0 days 00:00:28.999583
43,0.7113347055916722,,0.9977724784510349,0.2548481430209565,8.0,,,lightgbm,28.0,smote,4.0,0.998773496837361,COMPLETE,0 days 00:00:25.281277
44,0.7110404668771614,,0.9408378005490351,0.2521644169049129,8.0,,,lightgbm,28.0,smote,4.0,0.9984832876779094,COMPLETE,0 days 00:00:25.922053
45,0.7098889930855575,,0.9792363159379107,0.2812956221378523,8.0,,,lightgbm,28.0,smote,4.0,0.9899138687725242,COMPLETE,0 days 00:00:26.479254
46,0.706864884700904,,0.9815030811547801,0.2853581626057716,7.0,,,lightgbm,15.0,smote,4.0,0.997564094627739,COMPLETE,0 days 00:00:22.896284
47,0.6963986161501117,,0.9460421629028071,0.28237851142560394,7.0,,,lightgbm,5.0,smote,4.0,0.9761655847924731,COMPLETE,0 days 00:00:22.675589
48,0.7104291881251793,,0.9456701774591414,0.25491610561740097,7.0,,,lightgbm,25.0,smote,4.0,0.969585989832236,COMPLETE,0 days 00:00:16.915043
49,0.7083424294334629,,0.926980176204717,0.1878879331234618,7.0,,,lightgbm,24.0,under,,0.9693333259448402,COMPLETE,0 days 00:00:04.557013
