number,value,params_C,params_colsample_bytree,params_learning_rate,params_max_depth,params_min_samples_leaf,params_min_samples_split,params_model_name,params_n_estimators,params_subsample,state,duration
0,0.9047729396584829,,0.7148734570442585,0.2506419775767486,8.0,,,xgboost,6.0,0.715088527323569,COMPLETE,0 days 00:00:13.587337
1,0.9032845323061194,0.4707530853918088,,,,,,svm,,,COMPLETE,0 days 00:00:30.943674
2,0.9019808231715519,,,,9.0,3.0,10.0,random_forest,18.0,,COMPLETE,0 days 00:00:13.809214
3,0.8912604174429247,,,,5.0,3.0,5.0,random_forest,21.0,,COMPLETE,0 days 00:00:12.481840
4,0.9018396891271688,2.999459072873406,,,,,,svm,,,COMPLETE,0 days 00:00:44.757027
5,0.9087296896823833,,0.9548109500455793,0.24915091014289373,9.0,,,lightgbm,18.0,0.7619497392287444,COMPLETE,0 days 00:00:12.733036
6,0.9072485268634881,,0.7103240240804367,0.18130234997457267,5.0,,,xgboost,21.0,0.7986999171639786,COMPLETE,0 days 00:00:15.035450
7,0.8882241771778777,,,,8.0,5.0,2.0,random_forest,7.0,,COMPLETE,0 days 00:00:11.422728
8,0.9031376872324522,0.5450540168939941,,,,,,svm,,,COMPLETE,0 days 00:00:31.168081
9,0.9086021364024335,,0.5802334334463511,0.26577540930874927,4.0,,,lightgbm,29.0,0.7448713740545279,COMPLETE,0 days 00:00:13.769853
10,0.9036023685689272,0.346268859730307,,,,,,svm,,,COMPLETE,0 days 00:00:27.964622
11,0.905897527300064,,0.9333668859420714,0.023625903978487267,7.0,,,lightgbm,13.0,0.982663738437987,COMPLETE,0 days 00:00:12.763028
12,0.9090144657421227,,0.5008447751172775,0.2957322032410927,3.0,,,lightgbm,30.0,0.5578860346475235,COMPLETE,0 days 00:00:13.401248
13,0.9088307926453206,,0.5220314927085127,0.2987946278856326,3.0,,,lightgbm,30.0,0.5327294078855185,COMPLETE,0 days 00:00:13.526641
14,0.9093310316586055,,0.9799979536949365,0.27984354392026956,3.0,,,lightgbm,30.0,0.5206555627113738,COMPLETE,0 days 00:00:12.516066
15,0.909239705679496,,0.5023011530392897,0.2980528265436101,3.0,,,lightgbm,30.0,0.5025508315351112,COMPLETE,0 days 00:00:13.276392
16,0.90854971139367,,0.8366670715680963,0.17080149384793464,3.0,,,lightgbm,26.0,0.5170013106793662,COMPLETE,0 days 00:00:11.883333
17,0.9089807379236724,,0.8535326459045242,0.17544490873486884,4.0,,,lightgbm,25.0,0.5017806762953679,COMPLETE,0 days 00:00:12.898246
18,0.9073986487624547,,0.8271616207600587,0.08054530060518492,5.0,,,lightgbm,24.0,0.6297540148088323,COMPLETE,0 days 00:00:13.140804
19,0.9076572800502363,,0.6367756735328173,0.09208398254822128,5.0,,,lightgbm,26.0,0.6369277297960075,COMPLETE,0 days 00:00:12.694091
20,0.9040100519747049,,0.6413906581839082,0.2158152715860892,4.0,,,xgboost,13.0,0.6388931728846234,COMPLETE,0 days 00:00:12.718808
21,0.9054124009461422,,0.9925709881793982,0.22026271456826796,4.0,,,xgboost,13.0,0.638620274027774,COMPLETE,0 days 00:00:12.707924
22,0.9092605705634377,,0.5057432545295169,0.2958032566505039,3.0,,,lightgbm,30.0,0.5782083183874062,COMPLETE,0 days 00:00:13.367656
23,0.9086449887709698,,0.5028613141234061,0.29997329855631694,3.0,,,lightgbm,30.0,0.5676843381087917,COMPLETE,0 days 00:00:13.520962
24,0.9093924892746706,,0.5818423226742189,0.2979297603787231,3.0,,,lightgbm,28.0,0.569268186634526,COMPLETE,0 days 00:00:13.345066
25,0.9086895690636174,,0.5644287711725904,0.2660928707637761,3.0,,,lightgbm,27.0,0.6075944970673184,COMPLETE,0 days 00:00:13.324326
26,0.9092577076280822,,0.5906687390185226,0.2629443067051111,6.0,,,lightgbm,27.0,0.5818684201905222,COMPLETE,0 days 00:00:13.565421
27,0.9097797153889036,,0.6255171735371508,0.2208366794636018,6.0,,,lightgbm,23.0,0.6913485448662269,COMPLETE,0 days 00:00:13.474321
28,0.9089882436488156,,0.780471321771838,0.21390631365103838,4.0,,,lightgbm,22.0,0.67853889220556,COMPLETE,0 days 00:00:12.483997
29,0.8959270335803492,,,,6.0,1.0,10.0,random_forest,23.0,,COMPLETE,0 days 00:00:12.639047
30,0.8960869652078637,,,,6.0,1.0,10.0,random_forest,24.0,,COMPLETE,0 days 00:00:12.359228
31,0.9087484421051096,,0.6562145725367879,0.2282332531354427,7.0,,,xgboost,28.0,0.8286277149503882,COMPLETE,0 days 00:00:15.047400
32,0.9092799129879025,,0.6384220918839907,0.23184750744573907,7.0,,,lightgbm,27.0,0.8491990514558176,COMPLETE,0 days 00:00:14.183266
33,0.9086480939973919,,0.553175002141439,0.2779809470421762,4.0,,,lightgbm,28.0,0.5776315356244568,COMPLETE,0 days 00:00:12.700353
34,0.9093401922660943,,0.6838269175865854,0.23653206137227722,7.0,,,lightgbm,28.0,0.8687104340335299,COMPLETE,0 days 00:00:13.978220
35,0.9093393245886774,,0.6753488790600898,0.2374303847126194,7.0,,,lightgbm,20.0,0.8607873254430575,COMPLETE,0 days 00:00:12.457289
36,0.9020122845199948,2.181203466810122,,,,,,svm,,,COMPLETE,0 days 00:00:44.418677
37,0.901965241969464,2.3627907880707113,,,,,,svm,,,COMPLETE,0 days 00:00:42.376916
38,0.908808339080303,,0.6836758122623297,0.1324518860520949,8.0,,,lightgbm,16.0,0.8989974331020023,COMPLETE,0 days 00:00:13.772755
39,0.908780274355396,,0.6971960903417556,0.19038666240853547,8.0,,,lightgbm,16.0,0.8961941183983916,COMPLETE,0 days 00:00:13.875474
40,0.9022746363479555,,,,8.0,5.0,6.0,random_forest,19.0,,COMPLETE,0 days 00:00:14.856479
41,0.8988119475940165,,,,7.0,5.0,6.0,random_forest,20.0,,COMPLETE,0 days 00:00:14.968898
42,0.9083965974294211,,0.6115861457167524,0.2461389830782888,7.0,,,lightgbm,21.0,0.9028773288180527,COMPLETE,0 days 00:00:13.366877
43,0.9093123892175722,,0.7602075476257737,0.24144345035998413,7.0,,,lightgbm,22.0,0.911857473476045,COMPLETE,0 days 00:00:13.903672
44,0.9095406011520648,,0.7653925047352034,0.2027436020218372,9.0,,,lightgbm,25.0,0.9567293849629144,COMPLETE,0 days 00:00:13.884413
45,0.9093631432240334,,0.7363864516527868,0.20241373110614486,9.0,,,lightgbm,25.0,0.7077339426177092,COMPLETE,0 days 00:00:13.876959
46,0.9095157853113287,,0.7511048502391333,0.2067487106253207,9.0,,,lightgbm,25.0,0.9619284939412599,COMPLETE,0 days 00:00:13.455163
47,0.9097021056160481,,0.7403986882627495,0.19863747162893217,9.0,,,lightgbm,25.0,0.6896159801339151,COMPLETE,0 days 00:00:13.508597
48,0.907775595892731,,0.7416751048666835,0.20140579062193517,9.0,,,xgboost,25.0,0.9892459968142622,COMPLETE,0 days 00:00:16.930391
49,0.8983526007785597,,0.7910491143628726,0.14772958020893387,9.0,,,xgboost,5.0,0.997477533727357,COMPLETE,0 days 00:00:12.165538
