number,value,params_C,params_colsample_bytree,params_learning_rate,params_max_depth,params_min_samples_leaf,params_min_samples_split,params_model_name,params_n_estimators,params_subsample,state,duration
0,0.654582483496495,,0.8942161033759398,0.1651859861412726,6.0,,,lightgbm,24.0,0.7596712813351074,COMPLETE,0 days 00:00:04.373134
1,0.654641228884989,,0.5093014243434841,0.2889442422243235,6.0,,,xgboost,21.0,0.8732500703296939,COMPLETE,0 days 00:00:04.851560
2,0.6459188048058714,,0.949485604361282,0.04532615661270916,9.0,,,xgboost,7.0,0.6807170464629293,COMPLETE,0 days 00:00:04.639959
3,0.6503873856536168,,,,8.0,4.0,8.0,random_forest,23.0,,COMPLETE,0 days 00:00:03.106969
4,0.6510985782247354,,0.829316575156517,0.02182877094049703,8.0,,,xgboost,14.0,0.7166214931929774,COMPLETE,0 days 00:00:04.961440
5,0.6532441018478272,,0.9111022257449434,0.11532500466154903,6.0,,,xgboost,20.0,0.9769965804107581,COMPLETE,0 days 00:00:04.072277
6,0.6500109263984178,0.34975903404387826,,,,,,svm,,,COMPLETE,0 days 00:00:05.472155
7,0.6492289559801298,,0.5293233474687451,0.2079539820593741,8.0,,,xgboost,5.0,0.8453648042496877,COMPLETE,0 days 00:00:03.609121
8,0.6391424188291687,,,,4.0,1.0,10.0,random_forest,26.0,,COMPLETE,0 days 00:00:03.181266
9,0.6453582585686888,,0.7082787065877427,0.03761911825994145,4.0,,,xgboost,19.0,0.6407002085224084,COMPLETE,0 days 00:00:03.124888
10,0.6541114179308121,,0.7321990262671549,0.23808509397920632,9.0,,,lightgbm,14.0,0.6178114907553502,COMPLETE,0 days 00:00:02.888621
11,0.6499993036135248,2.9144052628139754,,,,,,svm,,,COMPLETE,0 days 00:00:04.157721
12,0.6541329195694828,,0.5098331959395782,0.282803035850056,6.0,,,lightgbm,29.0,0.8391170897930365,COMPLETE,0 days 00:00:03.367656
13,0.6521900463427489,,0.534765465320411,0.29930685942665963,6.0,,,lightgbm,30.0,0.8491263503440716,COMPLETE,0 days 00:00:04.028708
14,0.6558317760648728,,0.6324969506663563,0.15444087859301667,5.0,,,lightgbm,24.0,0.5113872140887108,COMPLETE,0 days 00:00:04.136082
15,0.6560148924717646,,0.629022245592886,0.1490442808983102,5.0,,,lightgbm,24.0,0.9782390697715329,COMPLETE,0 days 00:00:03.699401
16,0.6481550838595952,,0.6510581677502609,0.11038872505308281,3.0,,,lightgbm,16.0,0.5612165738946389,COMPLETE,0 days 00:00:02.988112
17,0.6419392675792345,,,,5.0,5.0,2.0,random_forest,22.0,,COMPLETE,0 days 00:00:02.679516
18,0.6560587733940181,,0.6267605103826728,0.14947873458001712,4.0,,,lightgbm,26.0,0.5188815937278747,COMPLETE,0 days 00:00:03.122712
19,0.6557914062252405,,0.6407245245423215,0.1504416219053461,4.0,,,lightgbm,26.0,0.9950561127231977,COMPLETE,0 days 00:00:03.064909
20,0.651782474057608,,0.6121056070588411,0.09554111611336658,3.0,,,lightgbm,27.0,0.9528711115785812,COMPLETE,0 days 00:00:03.029792
21,0.6513037535286893,,0.6036138205696722,0.0878977678242393,3.0,,,lightgbm,27.0,0.929995396087329,COMPLETE,0 days 00:00:03.856141
22,0.6567165220750534,,0.5962479165663763,0.1773913360840407,5.0,,,lightgbm,25.0,0.5104441891844732,COMPLETE,0 days 00:00:04.375363
23,0.6554830231832846,,0.6883121421516888,0.16469166212790992,5.0,,,lightgbm,24.0,0.5247348060575634,COMPLETE,0 days 00:00:03.611694
24,0.6557742869587456,,0.7038998263055225,0.20303930763831543,5.0,,,lightgbm,17.0,0.5114320474751141,COMPLETE,0 days 00:00:02.917689
25,0.6500002562024902,2.0728959850832633,,,,,,svm,,,COMPLETE,0 days 00:00:04.088576
26,0.6500002477371142,2.140357816220625,,,,,,svm,,,COMPLETE,0 days 00:00:04.244043
27,0.6563692720106914,,0.5747187448064953,0.19140760315296046,4.0,,,lightgbm,29.0,0.5965115152688428,COMPLETE,0 days 00:00:03.298554
28,0.6566989818994274,,0.5890758487267799,0.20150520730783955,4.0,,,lightgbm,29.0,0.5867604819363559,COMPLETE,0 days 00:00:03.739691
29,0.6571670898632195,,0.5703590341951125,0.20010234566875712,4.0,,,lightgbm,30.0,0.6042568875830487,COMPLETE,0 days 00:00:04.424432
30,0.6559554724132942,,0.5752954257273789,0.21385299273141653,4.0,,,lightgbm,30.0,0.5870150192478057,COMPLETE,0 days 00:00:04.028743
31,0.6524463897170313,,0.8105792529346265,0.2308071408245025,7.0,,,lightgbm,30.0,0.5746945412290554,COMPLETE,0 days 00:00:03.598218
32,0.6567167213491283,,0.5694077284371217,0.2354715966654767,4.0,,,lightgbm,28.0,0.5656599613845821,COMPLETE,0 days 00:00:03.289958
33,0.6562975676938475,,0.5778944194254158,0.18458468484465426,4.0,,,lightgbm,28.0,0.6388191177369364,COMPLETE,0 days 00:00:03.224083
34,0.6556830652120521,,0.5590154153843716,0.258196964099201,3.0,,,lightgbm,28.0,0.656055901125842,COMPLETE,0 days 00:00:03.190115
35,0.6364405559330996,,,,3.0,1.0,3.0,random_forest,28.0,,COMPLETE,0 days 00:00:03.073728
36,0.642923804673082,,,,5.0,1.0,3.0,random_forest,26.0,,COMPLETE,0 days 00:00:03.579583
37,0.6548220853295835,,0.6672153210472348,0.2410990386313838,5.0,,,lightgbm,26.0,0.5514842177433773,COMPLETE,0 days 00:00:03.973385
38,0.6541731315431073,,0.6689883438669214,0.25029958784068135,5.0,,,lightgbm,11.0,0.5505761692141286,COMPLETE,0 days 00:00:03.196228
39,0.6562005120954634,,0.7689831744108907,0.22581182783895354,4.0,,,lightgbm,25.0,0.6925795161619686,COMPLETE,0 days 00:00:02.968691
40,0.6543752360971006,,0.7846826134896875,0.18445727141396764,4.0,,,xgboost,22.0,0.7411821387747769,COMPLETE,0 days 00:00:03.335182
41,0.655584281516386,,0.5515412525026754,0.17561620743263853,7.0,,,xgboost,22.0,0.7736014804734794,COMPLETE,0 days 00:00:04.456271
42,0.6561746771665843,,0.5836159630900564,0.18251626774660665,4.0,,,lightgbm,29.0,0.6033375167834034,COMPLETE,0 days 00:00:03.283691
43,0.656918212800105,,0.554926907177873,0.1835128253498658,4.0,,,lightgbm,29.0,0.6069409717027973,COMPLETE,0 days 00:00:04.439192
44,0.6553308608544007,,0.500240238455627,0.19578655741922554,3.0,,,lightgbm,29.0,0.6087904180169438,COMPLETE,0 days 00:00:04.249241
45,0.6557215365088919,,0.5143217646228162,0.27372058679373334,3.0,,,lightgbm,28.0,0.5417316054300507,COMPLETE,0 days 00:00:03.111886
46,0.6500109421002579,0.37540199951842945,,,,,,svm,,,COMPLETE,0 days 00:00:04.200919
47,0.6500299092499892,0.12803766474329503,,,,,,svm,,,COMPLETE,0 days 00:00:03.989446
48,0.6567619186403187,,0.5437796098426099,0.21677378954451892,4.0,,,lightgbm,30.0,0.6678450565215363,COMPLETE,0 days 00:00:03.294947
49,0.6557785217695226,,0.9933669766240802,0.21743178398130333,4.0,,,lightgbm,30.0,0.685093568799429,COMPLETE,0 days 00:00:02.520747
